{
  "pair_id": "m2sl_yoy_spy",
  "parquet_path": "data/m2sl_yoy_spy_daily_19930129_20260617.parquet",
  "schema_version": "1.0.0",
  "generated_at": "2026-06-19T10:26:03Z",
  "columns": {
    "date": {
      "dtype": "datetime64[ns]",
      "unit": "date",
      "display_name": "Date",
      "direction": "neutral",
      "description": "Daily date index; spans 1993-01-29 through 2026-06-17."
    },
    "spy": {
      "dtype": "float64",
      "unit": "price",
      "display_name": "SPY Close ($)",
      "direction": "neutral",
      "description": "SPY adjusted close from Yahoo Finance.",
      "source_reference": "yahoo:SPY",
      "refresh_ttl_days": 1
    },
    "reference_month_end": {
      "dtype": "datetime64[ns]",
      "unit": "date",
      "display_name": "M2SL Reference Month End",
      "direction": "neutral",
      "description": "Reference-period month end for the carried M2SL observation.",
      "source_reference": "FRED:M2SL",
      "refresh_ttl_days": 30
    },
    "release_date": {
      "dtype": "datetime64[ns]",
      "unit": "date",
      "display_name": "M2SL Release Date",
      "direction": "neutral",
      "description": "Assumed market availability date: fourth Tuesday of the following month for the prior-month M2SL value.",
      "source_reference": "FRED:M2SL",
      "refresh_ttl_days": 30
    },
    "m2sl_usd": {
      "dtype": "float64",
      "unit": "usd",
      "display_name": "M2 Money Stock ($bn)",
      "direction": "neutral",
      "description": "FRED M2SL level, billions of dollars, seasonally adjusted. Included for provenance only; strongly trending and not recommended as a signal.",
      "source_reference": "FRED:M2SL",
      "refresh_ttl_days": 30
    },
    "m2sl_pct_yoy": {
      "dtype": "float64",
      "unit": "pct",
      "display_name": "M2 Money Supply YoY (%)",
      "direction": "higher_is_better",
      "description": "Year-over-year percent change of FRED M2SL; primary canonical indicator signal.",
      "source_reference": "derived:FRED:M2SL pct_change(12)*100",
      "refresh_ttl_days": 30
    },
    "m2sl_pct_mom": {
      "dtype": "float64",
      "unit": "pct",
      "display_name": "M2 Money Supply MoM (%)",
      "direction": "higher_is_better",
      "description": "Month-over-month percent change of FRED M2SL.",
      "source_reference": "derived:FRED:M2SL pct_change(1)*100",
      "refresh_ttl_days": 30
    },
    "m2sl_3m_pct": {
      "dtype": "float64",
      "unit": "pct",
      "display_name": "M2 Money Supply 3M Change (%)",
      "direction": "higher_is_better",
      "description": "Three-month percent change of FRED M2SL.",
      "source_reference": "derived:FRED:M2SL pct_change(3)*100",
      "refresh_ttl_days": 30
    },
    "m2sl_6m_pct": {
      "dtype": "float64",
      "unit": "pct",
      "display_name": "M2 Money Supply 6M Change (%)",
      "direction": "higher_is_better",
      "description": "Six-month percent change of FRED M2SL.",
      "source_reference": "derived:FRED:M2SL pct_change(6)*100",
      "refresh_ttl_days": 30
    },
    "m2sl_yoy_accel_pct": {
      "dtype": "float64",
      "unit": "pct",
      "display_name": "M2 YoY Acceleration (pp)",
      "direction": "higher_is_better",
      "description": "One-month change in M2 YoY growth, in percentage points.",
      "source_reference": "derived:diff(m2sl_pct_yoy)",
      "refresh_ttl_days": 30
    },
    "m2sl_yoy_zscore_120m": {
      "dtype": "float64",
      "unit": "none",
      "display_name": "M2 YoY 120M Z-Score",
      "direction": "higher_is_better",
      "description": "Rolling 120-month z-score of M2 YoY growth, minimum 60 observations.",
      "source_reference": "derived:rolling_zscore(m2sl_pct_yoy)",
      "refresh_ttl_days": 30
    },
    "m2sl_contraction_flag": {
      "dtype": "float64",
      "unit": "none",
      "display_name": "M2 YoY Contraction Flag",
      "direction": "lower_is_better",
      "description": "1.0 when M2 YoY growth is below 0%, marking money-supply contraction.",
      "source_reference": "derived:m2sl_pct_yoy<0",
      "refresh_ttl_days": 30
    },
    "days_since_release": {
      "dtype": "float64",
      "unit": "count",
      "display_name": "Days Since Release",
      "direction": "neutral",
      "description": "Calendar days since the most recent M2SL release available to the market.",
      "source_reference": "derived:release_calendar",
      "refresh_ttl_days": 30
    },
    "spy_ret": {
      "dtype": "float64",
      "unit": "decimal_return",
      "display_name": "SPY Daily Return (decimal)",
      "direction": "neutral",
      "description": "Simple SPY return over the daily panel frequency.",
      "source_reference": "yahoo:SPY",
      "refresh_ttl_days": 1
    },
    "spy_fwd_1d": {
      "dtype": "float64",
      "unit": "decimal_return",
      "display_name": "SPY 1-Day Forward Return",
      "direction": "neutral",
      "description": "Forward 1-trading-day SPY return, decimal.",
      "source_reference": "derived:yahoo:SPY",
      "refresh_ttl_days": 1
    },
    "spy_fwd_5d": {
      "dtype": "float64",
      "unit": "decimal_return",
      "display_name": "SPY 5-Day Forward Return",
      "direction": "neutral",
      "description": "Forward 5-trading-day SPY return, decimal.",
      "source_reference": "derived:yahoo:SPY",
      "refresh_ttl_days": 1
    },
    "spy_fwd_21d": {
      "dtype": "float64",
      "unit": "decimal_return",
      "display_name": "SPY 21-Day Forward Return",
      "direction": "neutral",
      "description": "Forward 21-trading-day SPY return, decimal.",
      "source_reference": "derived:yahoo:SPY",
      "refresh_ttl_days": 1
    },
    "spy_fwd_63d": {
      "dtype": "float64",
      "unit": "decimal_return",
      "display_name": "SPY 63-Day Forward Return",
      "direction": "neutral",
      "description": "Forward 63-trading-day SPY return, decimal.",
      "source_reference": "derived:yahoo:SPY",
      "refresh_ttl_days": 1
    },
    "spy_fwd_126d": {
      "dtype": "float64",
      "unit": "decimal_return",
      "display_name": "SPY 126-Day Forward Return",
      "direction": "neutral",
      "description": "Forward 126-trading-day SPY return, decimal.",
      "source_reference": "derived:yahoo:SPY",
      "refresh_ttl_days": 1
    },
    "spy_fwd_252d": {
      "dtype": "float64",
      "unit": "decimal_return",
      "display_name": "SPY 252-Day Forward Return",
      "direction": "neutral",
      "description": "Forward 252-trading-day SPY return, decimal.",
      "source_reference": "derived:yahoo:SPY",
      "refresh_ttl_days": 1
    }
  }
}
