{
  "pair_id": "ism_services_spy",
  "parquet_path": "data/ism_services_spy_monthly_19970731_20251031.parquet",
  "schema_version": "1.0.0",
  "generated_at": "2026-06-18T10:36:55Z",
  "columns": {
    "date": {
      "dtype": "datetime64[ns]",
      "unit": "date",
      "display_name": "Date",
      "direction": "neutral",
      "description": "Monthly date index; spans 1997-07-31 through 2025-10-31."
    },
    "ism_services_pmi": {
      "dtype": "float64",
      "unit": "index",
      "display_name": "ISM Services PMI",
      "direction": "higher_is_better",
      "description": "ISM Services headline PMI diffusion index. Values above 50 indicate services-sector expansion; values below 50 indicate contraction.",
      "source_reference": "Data Master.xlsx:ISM PMI!B / ISM",
      "refresh_ttl_days": 30
    },
    "ism_services_gap_50": {
      "dtype": "float64",
      "unit": "index",
      "display_name": "ISM Services PMI Gap to 50",
      "direction": "higher_is_better",
      "description": "ISM Services PMI minus the 50 expansion/contraction threshold.",
      "source_reference": "Data Master.xlsx:ISM PMI!B / ISM",
      "refresh_ttl_days": 30
    },
    "ism_services_delta": {
      "dtype": "float64",
      "unit": "index",
      "display_name": "ISM Services PMI Monthly Change",
      "direction": "higher_is_better",
      "description": "One-month change in the ISM Services PMI level, in index points.",
      "source_reference": "Data Master.xlsx:ISM PMI!B / ISM",
      "refresh_ttl_days": 30
    },
    "ism_services_3m_change": {
      "dtype": "float64",
      "unit": "index",
      "display_name": "ISM Services PMI 3M Change",
      "direction": "higher_is_better",
      "description": "Three-month change in the ISM Services PMI level, in index points.",
      "source_reference": "Data Master.xlsx:ISM PMI!B / ISM",
      "refresh_ttl_days": 30
    },
    "ism_services_6m_change": {
      "dtype": "float64",
      "unit": "index",
      "display_name": "ISM Services PMI 6M Change",
      "direction": "higher_is_better",
      "description": "Six-month change in the ISM Services PMI level, in index points.",
      "source_reference": "Data Master.xlsx:ISM PMI!B / ISM",
      "refresh_ttl_days": 30
    },
    "ism_services_zscore_60m": {
      "dtype": "float64",
      "unit": "none",
      "display_name": "ISM Services PMI 60M Z-Score",
      "direction": "higher_is_better",
      "description": "Rolling 60-month z-score of the ISM Services PMI level, minimum 36 observations.",
      "source_reference": "Data Master.xlsx:ISM PMI!B / ISM",
      "refresh_ttl_days": 30
    },
    "ism_services_above_50": {
      "dtype": "float64",
      "unit": "none",
      "display_name": "ISM Services PMI Above 50 Flag",
      "direction": "higher_is_better",
      "description": "1.0 when ISM Services PMI is above 50, else 0.0.",
      "source_reference": "Data Master.xlsx:ISM PMI!B / ISM",
      "refresh_ttl_days": 30
    },
    "spy": {
      "dtype": "float64",
      "unit": "price",
      "display_name": "SPY Close ($)",
      "direction": "neutral",
      "description": "SPY adjusted close from Yahoo Finance.",
      "source_reference": "yahoo:SPY",
      "refresh_ttl_days": 1
    },
    "spy_ret": {
      "dtype": "float64",
      "unit": "decimal_return",
      "display_name": "SPY Monthly Return",
      "direction": "neutral",
      "description": "Simple SPY return over the monthly panel frequency.",
      "source_reference": "yahoo:SPY",
      "refresh_ttl_days": 1
    },
    "spy_fwd_1m": {
      "dtype": "float64",
      "unit": "decimal_return",
      "display_name": "SPY Forward 1M Return",
      "direction": "neutral",
      "description": "Forward 1-month SPY return, decimal.",
      "source_reference": "yahoo:SPY",
      "refresh_ttl_days": 1
    },
    "spy_fwd_3m": {
      "dtype": "float64",
      "unit": "decimal_return",
      "display_name": "SPY Forward 3M Return",
      "direction": "neutral",
      "description": "Forward 3-month SPY return, decimal.",
      "source_reference": "yahoo:SPY",
      "refresh_ttl_days": 1
    },
    "spy_fwd_6m": {
      "dtype": "float64",
      "unit": "decimal_return",
      "display_name": "SPY Forward 6M Return",
      "direction": "neutral",
      "description": "Forward 6-month SPY return, decimal.",
      "source_reference": "yahoo:SPY",
      "refresh_ttl_days": 1
    },
    "spy_fwd_12m": {
      "dtype": "float64",
      "unit": "decimal_return",
      "display_name": "SPY Forward 12M Return",
      "direction": "neutral",
      "description": "Forward 12-month SPY return, decimal.",
      "source_reference": "yahoo:SPY",
      "refresh_ttl_days": 1
    }
  }
}
